<?xml version="1.0" encoding="UTF-8"?>
<olympics xmlns:xsi="http://www.w3.org/2001/XMLSchema-instance"
          xsi:noNamespaceSchemaLocation="ex2.xsd"
          year="2025" city="Vienna">
    <sports>
        <sport id="s1" type="team">
            <name>Baseball</name>
            <teams>
                <team country="Austria">
                    <coach>Felix Bauer</coach>
                    <players>
                        <player id="p1">Stefan Berger</player>
                    </players>
                </team>
            </teams>
        </sport>
    </sports>
    <description>Olympics!</description>
</olympics>
